comment_count,comments,date,story,title
0,,"29 октября 2019, 09:14"," сообщает ,.,В Северо-Казахстанской, Павлодарской, Костанайской областях ожидается усиление ветра 15-20 м/с, в Северо-Казахстанской, местами в Павлодарской, ночью местами в Костанайской областях – порывы 23-28 м/с, в Костанайской области местами – туман. В Акмолинской области – усиление ветра ночью 15-20, местами порывы 23-28 м/с, днем местами 15-20 м/с. В Карагандинской, Восточно-Казахстанской областях местами ожидается усиление ветра 15-20, порывы 23-25 м/с, в Карагандинской области ночью и утром местами – туман. В Жамбылской, Атырауской, Актюбинской, ночью в Мангыстауской областях местами ожидается туман.,Больше новостей в Telegram-канале ,. Подписывайся!",Неустойчивая погода ожидается на большей части Казахстана во вторник
0,,"29 октября 2019, 09:15","Настоящим открытием на мировом рынке стали телевизоры LG OLED TV, которые привлекли к себе всеобщее внимание на выставке CES-2012. А уже в 2019 году посетителям IFA в Берлине LG представила первый в мире 8K OLED-телевизор, пожалуй, самый большой на сегодняшний день OLED-телевизор LG - 88-дюймовый LG SIGNATURE OLED 8K., ,Передовая технология OLED от LG основана на органических светодиодах, не требующих подсветки, благодаря чему качество изображения достигает беспрецедентного уровня и не имеет аналогов в мире. Глубокий черный цвет обеспечивает безграничную контрастность. LG OLED TV способен отобразить около 1 миллиарда цветов— Вы сможете уловить даже мельчайшие детали изображения.,В этом году LG представила телевизор NanoCell 8К, который обеспечивает полное погружение благодаря 8K-изображению с впечатляющей цветопередачей, контрастностью и детализацией в действительно большом масштабе. Технология NanoCell™ использует наночастицы, которые очищают цвета, отфильтровывая тусклые тона и улучшая цветопередачу.,На казахстанском рынке представлена линейка премиальных телевизоров 2019 года, включающая передовые OLED и NanoCell модели с улучшенным качеством изображения и звука с применением технологий искусственного интеллекта AI благодаря передовому интеллектуальному процессору второго поколения и алгоритму глубинного обучения.,Больше новостей в Telegram-канале ,. Подписывайся!",История телевизоров LG Electronics: от черно-белого до 8K
0,,"29 октября 2019, 09:23"," сообщает ,.,Об этом на своей странице в Facebook сообщил пресс-секретарь Президента Берик Уали.,Больше новостей в Telegram-канале ,. Подписывайся!",Токаев прибыл в Алматы
2,"круто, теперь после такой новости тысячи идиотов по всему миру побегут бросать бутылки в океаны и моря,Шанс на то что придёт ответ равен шансу выиграть в лотерее. Зачем мусорить?","29 октября 2019, 06:57"," передает ,.,Холли Романек гостила вместе с семьей в городе Сэнди-Хук, штат Нью-Джерси. Девушка решила отправить сообщение в пустой бутылке из-под холодного кофе. Она написала послание, поместила его в сосуд и бросила ""на удачу"" в воду.,В письме американка обратилась к вероятному адресату. В случае обнаружения послания, она предложила нашедшему его человеку написать ей на электронную почту. Спустя два месяца девушка получила ответ.,Автором находки стал мужчина, обнаруживший бутылку на скалах в бухте Флатрок, на острове Ньюфаундленд. Оказалось, что послание преодолело 1885 километров.,Отмечается, что бутылка попала в Гольфстрим, который течет узкой полосой вдоль побережья Северной Америки, после чего направляется на восток в сторону Великобритании.,Больше новостей в Telegram-канале ,. Подписывайся!","Девушка получила ответ на послание в бутылке, выброшенную в океан"
0,,"29 октября 2019, 09:29",", сообщает , со ссылкой на ,.,Напомним, похитительница работала в том самом детсаду и прекрасно знала ребёнка, он был в её группе. Только чтобы осуществить свой преступный замысел, ей пришлось оформить отпуск. Замаскировавшись, она пришла за ребёнком в образе таинственной знакомой родителей мальчика. Воспитательница даже придумала убедительную легенду: якобы папа с мамой малыша попали в аварию, и никак не могут его забрать. Но нянечка, подменявшая отпускницу, буквально на пороге заподозрила что-то неладное и ,. ,В акимате заговорили об усилении мер безопасности и контроля в детсадах. К слову, родители жертвы несостоявшегося похищения довольны приговором суда. А вот родня обвиняемой намерена обжаловать вердикт судьи.,Больше новостей в Telegram-канале ,. Подписывайся!",Попытка похищения ребенка из детсада: родные осужденной намерены обжаловать приговор
0,,"29 октября 2019, 09:34"," сообщает ,.,Этот форум - одно из ярких бизнес-событий в Алматы. Форум соберет сотни предпринимателей, руководителей компаний, директоров по маркетингу, маркетологов, среди которых могут быть ваши новые партнеры, клиенты или друзья.,Тарас Левчик - Эксперт по трафику №1 в СНГ,Кир Уланов - Маркетинг-ревизор,Денис Каплунов - Основатель агентства копирайтинга ""Студия Дениса Каплунова"",Владислав Бермуда - Эксперт по кросс маркетингу №1, предприниматель, маркетолог, писатель,Михаил Грибов - Ведущий эксперт по нетворкингу и личному бренду,Борис Жалило - Бизнес тренер №1 по продажам в России,Ян Сташкевич - Основатель SMM-агентства Ragoo Creative,Больше новостей в Telegram-канале ,. Подписывайся!",Известные эксперты по маркетингу выступят на форуме в Алматы
0,,"29 октября 2019, 09:39"," передает ,.,Совместная работа начата по итогам мониторинга состояния лекарственного обеспечения, проведенного территориальными подразделения Комитета фармации в связи с поступлением в конце 2017 года в адрес Министерства большого количества обращений граждан на перебои в обеспечении лекарственными средствами на амбулаторном уровне.,В феврале 2018 года были сформированы мониторинговые группы, которые выявили факты неполучения пациентами выписанных лекарств и неиспользованные остатки лекарств за 2016 - 2017 годы. При этом отдельные пациенты не знали о выписке им бесплатных рецептов и соответственно не получали выписанные лекарственные средства, однако в программе ИСЛО данные рецепты отмечены как обеспеченные.,Данные материалы министерством здравоохранения были переданы в Генеральную прокуратуру.,В июле текущего года продолжена работа Министерства по анализу рационального использования и обеспеченности лекарственными средствами. Так, в Западно-Казахстанской области допущено уничтожение препаратов в связи с истечением срока годности, на общую сумму 5,8 млн тенге.,Необходимо отметить, что с 2018 года закуп лекарственных средств для бесплатного амбулаторного лекарственного обеспечения централизовано осуществляется ТОО ""СК-Фармация"", а оплата данных услуг производится Фондом социального медицинского страхования по фактически отпущенным рецептам. Потребность в лекарственных средствах формировалась Управлениями здравоохранения регионов.,Однако со стороны Управлений здравоохранений формирование заявок проводились без учета фактических данных диспансерных больных.,По результатам проведенных проверок министерством принят комплекс мер по надлежащему регулированию в сфере лекарственного обеспечения населения. Изменены Правила лекарственного обеспечения граждан: теперь потребность определяется только с учетом данных Регистра диспансерных больных.,Кроме того, за ненадлежащее исполнение обязанностей отдельные должностные лица Министерства здравоохранения были уволены по отрицательным мотивам. В отношении должностных лиц подведомственных организаций проводится досудебное расследование.,Осуществлен переход на безбумажный документооборот: в медицинских организациях активно цифровизуются все процессы. Так, электронный Регистр диспансерных больных позволит автоматически формировать потребность в лекарствах с учетом имеющихся в информационной программе данных об остатках. Внедрен электронный паспорт здоровья граждан, в котором отражается информация об отпущенных лекарствах.,В результате цифровизации и интеграции информационных систем лекарственного обеспечения поликлиник позволило охватить 100% выпиской электронных рецептов на бесплатные лекарства и вести учет остатков лекарств в онлайн режиме.,По результатам проверок министерства, на должностных лиц составлены 8 административных протоколов, в двух случаях приняты дисциплинарные меры, материалы 4 проверок направлены в территориальные департаменты ведомства министерства для принятия мер в пределах своей компетенции.,Эффективное сотрудничество министерства здравоохранения с органами прокуратуры в части мониторинга лекарственного обеспечения как на республиканском, так и на региональном уровнях, привело к получению значительной экономии бюджетных средств, улучшению доступности лекарственных средств пациентам.,На коллегии министерством предложено продолжить эту работу на системной основе не только в системе здравоохранения, но и в организациях других ведомств.,Больше новостей в Telegram-канале ,. Подписывайся!",Бесплатные рецепты не дошли до казахстанских пациентов
10,"о ЛГБТ обязательно упомянуть надо?,Ну, это, видимо, для того, чтобы не жалели сильно, типа ""какой молодой, симпатичный, все-таки наш по крови"",у них это видимо предмет особой гордости,загубили парня,Как жалко...такой красивый талантливый мальчик ....иманды болсын,Такой молодой, а уже лгбтэшник.,Там это в тренде сейчас, отцом ты можешь и не быть, но голубым ты быть обязан.,Вот зачем туда ехать? Сколько народу участвует в лотерее чтобы попасть туда каждый год,Умирают и политики и музыканты, военные и пацифисты, учителя и осуждённые, геи, лесби и тп и монахи. Смерть не делит на рассы, профессии, возраста и убеждения в отличии от людей.Смерть парня и его участие в ЛГБТ сообщество,  как-то связано?,Никак не связано. Нельзя забывать на каком сайте находишься, только здесь в круглосуточном режиме разжигается ненависть между нациями, а в адрес конкретно казахской нации сыпятся оскорблениями как из рога изобилия. Один даже тут написал, что все казахи геи, другой написал, что все казахи мамбеты и калбиты, третий написал, что все казахи зверьки. Конечно это писали с целью разжигания ненависти, кто писал - не выявили.","29 октября 2019, 07:16"," Об этом пишет ,.,Парень скончался 1 сентября в доме своей семьи. О причинах смерти не сообщается.,Дэвин родился в Костанае и был усыновлен в возрасте 14 месяцев Уэйном и Кэтлин Такэбери. На момент смерти он учился в 12 классе средней школы.,Дэвин поддерживал связи с казахской диаспорой, у него было много друзей. Молодой человек увлекался фотографией, живописью, гимнастикой и танцами. Его работы были отмечены двумя золотым наградами национальной премии Scholastic Awards 2018.,Помимо этого, по информации издания, Дэвин был открытым представителем ЛГБТ-сообщества. Он участвовал в общественных дискуссиях с учителями, студентами и другими членами общины.,Больше новостей в Telegram-канале ,. Подписывайся!",Усыновленный американцами казах скончался в США
0,,,,
0,,,,
0,,"29 октября 2019, 07:34"," сообщает ,.,В минувшие выходные в рамках вечера бокса в Алматы 29-летний Рысбек встречался с Мухитдином Раджапбаевым из Узбекистана (10-7-1, 7 КО). Поединок был рассчитан на восемь раундов, но завершился в первом, когда казахстанец отправил соперника в нокаут.,Этот успех позволил Рысбек совершить рывок в рейтинге BoxRec второго среднего веса и расположиться на 201-м месте.,Напомним, что главным событием вечера бокса в Алматы стал бой за титул WBO International в среднем весе между его обладателем казахстанцем Канатом Исламом (26-0, 21 KO) и намибийцем Уолтером Каутондоквой (18-1, 17 КО). В пятом раунде претендент оказался в нокдауне, но сумел достоять до финального гонга. По итогам десяти раундов судьи отдали победу Исламу.,Больше новостей в Telegram-канале ,. Подписывайся!","Казахстанец ""рванул"" на 325 мест в рейтинге после победы над узбекским боксером"
0,,"29 октября 2019, 10:09"," сообщает ,.,Полученные в рамках Программы льготного финансирования средства, крупнейший производитель железобетонных конструкций ТОО ""Темирбетон - 1"" направит на производство нового вида продукции – раструбных труб. Это в свою очередь даст возможность южным регионам Казахстана качественно обновить инженерные сети по выводу сточных вод.,Финансирование оборотного капитала ТОО ""Темирбетон - 1"" будет  направлено на диверсификацию производства. Данный проект важен еще и тем, что позволит снизить риски возникновения экологической угрозы в регионе.,Программа льготного финансирования в капитал, запущенная АО ""Казына Капитал Менеджмент"", предлагает финансовый инструмент, альтернативный банковскому кредитованию. Финансирование в рамках Программы получают представители крупного бизнеса и МСБ, представленные в разных отраслях, в том числе обрабатывающей промышленности, сфере инфраструктуры и сельского хозяйства.,Больше новостей в Telegram-канале ,. Подписывайся!","ТОО ""Темирбетон - 1"" запустит новую линейку продукции благодаря ККМ"
0,,,,
0,,,,
0,,"29 октября 2019, 10:24"," передает ,.,Первое место, которое посетил глава государства, стал акимат мегаполиса. Здесь проходит совещание по социально-экономическому развитию города.,Президент открыл собрание.,Аким города Бакытжан Сагинтаев представил главе государства стратегию развития Алматы-2050.,По итогам определен перечень актуальных и резонансных для горожан вопросов, над решением которых акимат занялся в первоочередном порядке.,В Алматы глава государства пробудет два дня, посетит ряд объектов и проведет несколько встреч.,Сегодня Президент ознакомится с презентацией программы ""Жаңа Алматы"", вручит ключи от квартир воспитанникам детских домов, а также примет участие в совещании по социально-экономическому развитию города Алматы. Кроме того, он ознакомится с работой инновационного кластера ""Teсh Garden"", деятельностью Инвестиционного дома, посетит КазНУ имени аль-Фараби, где осмотрит учебные корпуса и центр обслуживания студентов ""Керемет"". Во второй день рабочей поездки глава государства в своей алматинской резиденции проведет ряд встреч.,Больше новостей в Telegram-канале ,. Подписывайся!","Сагинтаев рассказал Токаеву о том, как будет развиваться Алматы"
0,,"29 октября 2019, 10:19"," передает , со ссылкой на пресс-службу акима Туркестанской области.,Отметим, на сегодняшний день из 12 сельских округов района отремонтированы здания акиматов сельских округов Жузимдик и Актобе, они уже работают в новом формате. В дальнейшем акиматы всех сельских округов района перейдут на такой формат работы.,Больше новостей в Telegram-канале ,. Подписывайся!","Госучреждения Келесского района Туркестанской области переходят на ""Оpen Space"""
