comment_count,comments,date,story,title
0,,"29 октября 2019, 11:57"," передает ,.,Он отметил, что надо запретить плотную застройку в центральных частях Алматы и уделить внимание парковым зонам.,Больше новостей в Telegram-канале ,. Подписывайся!",Токаев раскритиковал снос исторических зданий в Алматы
0,,,,
0,,,,
9,"Поэтому нужно доделовать начатое, а то как попала сделают, потом выговор получают.,Осылай бір ұрсып алғаны да дұрыс негізі),Посмотрите какое строительство ведётся вдоль речки в районе верхней Пятилетки. Выше Аль Фараби по улице Ракышева. От речки 10 метров.,Нужно было проконтролировать все от и до.,Тогда Бакытжан Сагинтаев объявил выговор руководителю Управления зеленой экономики Ержану Сейтенову и начальнику отдела Управления зеленой экономики Олжасу Джаныспаеву....и что с того?,Токаев обьявил выговор замакима Алматы....и уже ,даже не смешно и сарказм притупился,Бостан босқа бермейді ғой, бастаған жұмысын соңына дейін аяқтауы керек еді.,9 августа 2015 года Бауржан Байбек назначен акимом г. Алматы. С 31 октября 2015 года движение трамвая в городе прекращено. Во второй половине 2016 года решением акима города Бауыржана Байбека демонтирована контактная сеть, а в 2017 году демонтированы трамвайные пути на улицах Торайгырова, Утепова, Шевченко и Кунаева.","29 октября 2019, 11:55"," передает ,.,Поводом послужил случай , склонов Кок-Тобе.,13 октября в рамках акции озеленения Jasyl Almaty на пострадавшем от пожара склоне горы Кок-Тобе 500 волонтеров высадили 40 тысяч саженцев яблони Сиверса и 500 тысяч луковиц тюльпанов сортов ""Казахстан"" и ""Нурсултан Назарбаев"". Позже представители экологического общества ""Зеленое спасение"" выявили, что на склоне, где производилась высадка, остались брошенными саженцы яблонь, луковицы тюльпанов и инвентарь.,Тогда Бакытжан Сагинтаев объявил выговор руководителю Управления зеленой экономики Ержану Сейтенову и начальнику отдела Управления зеленой экономики Олжасу Джаныспаеву.,Больше новостей в Telegram-канале ,. Подписывайся!",Токаев обьявил выговор первому замакима Алматы
20,"Жалко уже поздно(,Рельсы убрали.,А где же он раньше был?,Или не смел перечить музыканту*?,Он тогда не был президентом же.,Бұл кездесуде бірқатар өзекті мәселелр көтерілген екен.,Новые проложат, делов-то.. на пару миллиардов ...,ничего спорного, нужно было проекты по ЛРТ проталкивать, а кому они были нужны при действующих и более дешевых трамваях, с которыми бюджета не по пилишь,+1000050000000000,президент тоже не поддерживает ЛРТ есьче.,Это  же своеобразная особенность Алматы, как же без них?),Сонымен трамвай қалатын болды ма ?),- Кстати, ликвидация трамвайного сообщения, мягко говоря, было спорным решением....ТОГДА ПОСАДИТЕ РЕШАЛУ,, а только бла,бла,бла,блин, ток писать начал что опечатались вы чётко..но увы не успел...,Кому то приглянулся трамвайный парк (депо), район хороший Байтурсынова-Толе би несколько гектаров земли, скоро там новые дома наверно построят или торговый центр.,Планировали Lrt, но жизнь внесла свои коррективы, то бишь,что денег нет чтобы в Нур-Султане закончить,поторопились значит с трамваями,Помимо трамваев, нужно метро увеличивать - это сильно снизит нагрузку на дорогах.,Метро и трамвайный транспорт нужны для такого большого города. Обновлять его просто надо, чтобы был комфортным для передвижения.,У нас многие любили трамваи! очень жаль, что их убрали, но может теперь вернут, раз президент об этом заговорил?","29 октября 2019, 11:36",", передает ,.,Он обратил внимание на развитие общественного транспорта.,Больше новостей в Telegram-канале ,. Подписывайся!",Президент об устранении трамваев в Алматы: Это был спорный вопрос
0,,,,
0,,,,
1,"В Америке нашли у таксиста  миллионы, как оказалось потом это выигрыш в лотерею клиент забыл. Вот это я понимаю новость, а у нас только оружие можно найти ? )))","29 октября 2019, 12:14"," сообщает ,По данному факту начато досудебное расследование, предусмотренное , УК РК (Незаконное приобретение, хранение, перевозка или ношение огнестрельного оружия и боеприпасов). Номера на пистолете стерты и его принадлежность пока не установлена. В этой связи назначены необходимые экспертизы, в ходе которых изъятый ""ПМ"" будет также проверен на причастность к преступлениям с применением огнестрельного оружия.,В полиции отметили, что водителю пока грозит административное наказание за управление авто в нетрезвом состоянии, а также уголовная ответственность за незаконное хранение, перевозку, ношение огнестрельного оружия и боеприпасов.,За последние 9 месяцев в регионе изъято из незаконного оборота 126 единиц огнестрельного оружия, среди них гладкоствольное, нарезное, травматическое и газовое.,Больше новостей в Telegram-канале ,. Подписывайся!","Пистолет ""Макарова"" с патронами нашли у таксиста в Алматинской области"
2,"Рыба гниет с головы..не я сказал,"".... взяток от предпринимателя на общую сумму 15 млн тенге, за подписание актов выполненных работ"".,А почему один человек подписывает Акт выполненных работ? Почему работу не принимает комиссия с составлением фото и видео отчетов? Ну раз до сих пор эту лавочку для коррупционеров не прикрыли, значит специально эту лавочку держат открытой. А тогда уже возникает другой вопрос - а зачем её держат открытой?","29 октября 2019, 12:08"," сообщает , со ссылкой на пресс-службу Антикоррупционной службы РК.,Сейчас решается вопрос об избрании меры пресечения. Окончательное решение о степени виновности подозреваемого, будет вынесено судом. ,Больше новостей в Telegram-канале ,. Подписывайся!",При получении взятки задержан глава Управления культуры Акмолинской области
13,"Потому что в акиматах сидят знакомые, а знакомые не хотят работать, или работают на не охотно. В этой связи надо кадровую политику города обновлять новому акиму. Брать тех ребят, которые будут работать, а ""не прятаться"" в кабинетах акимата.,Соглашусь, нужно дать возможность молодым и талантливым.,Сапар барысында көптеген маңызды тақырыптар сөз болды.,Речь идет об отсутствии новых производств, то есть про частный бизнес, там уже и льготное кредитование  и льготы по налогам предлагают, но желающих заняться производством каких-либо товаров не видно, акимат может только помочь, но он не может заставить частное лицо заняться производством. ,Толковые специалисты нужны в управлении, которые будут действительно работать. В городе много проблем, которые надо решать.,Да кончились уже давно толковые специалисты.,Где таких ребят сейчас найти?😁,автобусы в Алматы надо пересмотреть процедуру субсидирования - ввести субсидирование не за количество проданных билетов, а за количество рейсов. А иначе автобусы не соблюдают межавтобусные интервалы, приезжают через 30 мин., забивают до отказа,Президент прав. Нужно поднимать образование в Алмате. Там на самом деле хорошая база по подготовке кадров.,Алматы қаласында индустрияны дамыту керек.,Правильно - нужно вводить больше предприятий. Единственный момент- они должны быть прибыльными и приносить деньги.,Ну, я смотрю, у Токаева и сагинтаева мысли по развитию Алматы сходятся. это радует и дает надежду, что что в Алматы и дальше будут вливать деньги для развития,Еще один важный момент- город должен развиваться во всех направлениях, а не делаться акцент на чем-то одном","29 октября 2019, 11:30",", передает ,.,Он отметил, что нужно продолжать наполнять индустриальную зону новыми предприятиями.,Больше новостей в Telegram-канале ,. Подписывайся!","Токаев указал, в каком направлении следует развивать Алматы"
0,,"29 октября 2019, 12:54","      , ,- Считаю, что одна из основных проблем при реализации данного поручения – это непредсказуемость курса тенге. Курс тенге к доллару фактически находится на своем историческом максимуме и приблизился к психологической отметке в 400 тенге. ,Перейдя на так называемый свободно плавающий курс четыре года назад, Национальный банк на самом деле заложил мину замедленного действия под нашу экономику. Люди живут в постоянной боязни будущей девальвации. По опросам Нацбанка 67% населения ждут дальнейшую девальвацию тенге. Непредсказуемость курса стала главным негативным фактором в экономике, угнетающим предпринимательство и любую деловую активность.,- На самом деле свободно плавающий курс не защищает экономику от внешних факторов, а наоборот многократно их усиливает. При режиме валютного коридора курс тенге падал в связи с мировыми финансовыми кризисами. Сейчас же курс тенге прыгает при каждом движении цены на нефть в зависимости от разного рода спекуляций вокруг санкций, торговых войн, ставки ФРС (Федеральная резервная система США), которые вообще не касаются казахстанской экономики.,Этим пользуются спекулянты, чтобы зарабатывать на волатильности курса на нашей небольшой валютной бирже, где торги едва превышают 150-200 млн.долларов США. Любой негатив и шок используется для нагнетания паники среди населения. Это заставляет Национальный банк судорожно вмешиваться в валютные торги и тратить резервы. При этом формально отчитываются об отсутствии валютных интервенций. ,- В документах Международного валютного фонда написано много красивых слов о пользе свободноплавающего курса.,Сейчас свободно плавающий курс реализуется в 31 стране – в основном это развитые страны с широкой номенклатурой экспорта – Япония, Австралия, Канада, США, страны Западной Европы и другие.,Казахстанская экономика на 90% зависит от одного фактора – мировой цены на нефть. При свободноплавающем курсе мы соглашаемся, что бросаем тенге ""болтаться щепкой в проруби"".  Фактически мы расписываемся в потере самостоятельности монетарной политики.,Даже Китай с его диверсифицированной корзиной экспорта не может позволить себе плавающий курс и держит юань. Многие приводят в пример Россию, но с рублем такая же проблема, как и с тенге.,- В основном Нацбанк Казахстана преследует цели ""инфляционного таргетирования"".,Инструменты инфляционного таргетирования на сегодня являются высшим пилотажем в монетарной политике. Они хорошо работают в развитых экономиках, когда, например, ставка ФРС или ЕЦБ (Европейский центральный банк) реально влияет на предложение и стоимость денег. Нацбанк же свел политику инфляционного таргетирования к примитивному сжатию кредитования.,Вся излишняя ликвидность уходит не на кредиты бизнесу, а в ноты Нацбанка под 9%. Сейчас в нотах Нацбанка размещено более 3 трлн тенге. При этом никак не ограничивает рост предложения денег по другим каналам – бюджет, ЕНПФ, фонд проблемных кредитов и т.д. С другой стороны, девальвация тенге разгоняет инфляцию.,В итоге, мы, наоборот, получаем проинфляционную политику и дорогие кредиты. ,Думаю, что на сегодня Национальному банку совместно с Правительством необходимо срочно принять меры по формированию прозрачной и предсказуемой курсовой политики. Эти меры уже не раз обсуждались и на партийной площадке ""Nur Otan"" и в самом Мажилисе.  Об этих же проблемах и путях их решения неоднократно высказывалась и Ассоциация Финансистов Казахстана. Могу кратко их перечислить:,- обеспечить прозрачность конвертаций при привлечении внешних займов Правительства и субъектов квазигоссектора и их обслуживании;,- по заранее определенному графику конвертировать трансферты из Национального Фонда на открытом валютном рынке и публиковать результаты проведенных торгов;,- публиковать валютные интервенции Национального банка на ежедневной основе;,- обеспечить прозрачность при проведении валютных операций ЕНПФ на открытом валютном рынке;,- усилить систему мониторинга валютного рынка для недопущения спекулятивных всплесков;,- обеспечить превентивное смягчение колебаний курса тенге под влиянием налоговых выплат и других заранее прогнозируемых факторов.,Подготовил Владимир Демидов,Больше новостей в Telegram-канале ,. Подписывайся!","Что мешает реализации поручения Президента о господдержке компаний, работающих на экспорт "
0,,"29 октября 2019, 08:53"," передает , со ссылкой на пресс-службу ДП области. ,Так, 24 октября в Арысский РОП с заявлением обратился местный житель. У него с вольного пастбища бесследно пропал скот. С аналогичными заявлениями в полицию обратились еще десятки потерпевших. Данные факты зарегистрировали в ЕРДР Арысского РОП по , УК РК ""кража"" и начали досудебное расследование. Общая сумма ущерба, нанесенная потерпевшим, составила свыше трех миллионов тенге.,Была создана следственно-оперативная группа. Полицейские приступили к поискам. Также были созданы отряды добровольных помощников из числа местных жителей. Один из таких отрядов заметил на вольных пастбищах подозрительный автомобиль и сообщил об этом полицейским.,Прибывшие на место происшествия сотрудники полиции тщательно проверили оставленный бесхозный автомобиль, который принадлежал одному из подозреваемых.,Вокруг пастбищ и в салоне машины полицейские обнаружили вещественные доказательства, которые направили на экспертизы. Также через авто полицейские вышли на след подозреваемых. Оперативники сначала задержали владельца авто, а затем двух его подельников. ,По версии полиции, скотокрады промышляли на вольных пастбищах, расположенных между Казыгуртским и Арысским районами, там же разделывали краденный скот на мясо, которое затем на своей автомашине перевозили в Шымкент, где затем реализовывали его на городских рынках. ,Полицейские установили, что подозреваемые являются жителями Казыгуртского, Арысского районов и Шымкента, один из которых ранее судим. Также оперативники задержали скупщика краденного. Преступная группа оказалась причастна к 12 фактам скотокрадства в Казыгуртском районе, к семи фактам в Сарыагашском районе и к десяти фактам кражи скота в Арысском. В качестве вещественных доказательств изъяты топор, ножи и две автомашины подозреваемых. ,В настоящее время в полицию продолжают поступать заявления от сельчан в рамках данного уголовного дела. Следователи не исключают, что преступная группа может быть причастна к еще другим фактам скотокрадства, совершенных в районах области. В настоящее время следственно-оперативные мероприятия продолжаются., ,Больше новостей в Telegram-канале ,. Подписывайся!",Краденое мясо продавали на базарах Шымкента
0,,,,
0,,,,
