comment_count,comments,date,story,title
3,"Димаш - гордость Казахстана!!! Мы радуемся твоим успехам, Димаш, ты - единственный человек, который прославляет нашу Родину в 21 веке.,Одна просьба - не вступай в партию, будут уговаривать, будут давления, не поддавайся, оставайся человеком и сыном народа.,соблазн искушение  будет велик","29 октября 2019, 09:41",", сообщает , со ссылкой на пресс-службу МИД РК.,Он тепло пообщался с казахстанскими дипломатами и их семьями, вызвав неподдельный восторг своей скромностью и теплым отношением к детям.,Известный казахстанский певец также побывал в штаб-квартире ООН и поделился своими впечатлениями со Службой новостей ООН.,А завтра он выступит в программе ""Вечерний Ургант"".,Больше новостей в Telegram-канале ,. Подписывайся!",Димаша Кудайбергена пригласили в ООН
0,,,,
0,,,,
0,,"29 октября 2019, 10:50"," Эксперты, опрошенные , накануне Всемирного дня борьбы с этим заболеванием, который отмечается 29 октября, дали свои практические рекомендации, как предотвратить и избежать удара.,По данным Национальной системы здравоохранения (NHS) Великобритании, в Соединенном Королевстве каждые пять минут регистрируется как минимум один случай инсульта. Причем этому заболеванию в равной степени подвержены люди любого возраста, пола и социального положения. Если в конце прошлого столетия в ""зоне риска"" находились мужчины старше 45 лет и женщины старше 55, то сейчас инсульт встречается у 30-летних и даже у 25-летних молодых людей.,В особую группу риска врачи относят людей молодого и среднего возраста, которые много времени отдают работе. Постоянный стресс, ненормированный рабочий день, частые командировки и перелеты, а также неблагоприятная психологическая атмосфера приводят к выбросу адреналина и повышенному артериальному давлению.,Как рассказала представитель британской Ассоциации по борьбе с инсультом (Stroke Association) Клэр Шаттлуорф, для предотвращения инсульта необходимо следить за артериальным давлением.,[quote-Высокое давление – это самый главный контролируемый фактор риска инсульта. К сожалению, при развитии инсульта симптомы часто отсутствуют, поэтому многие люди не понимают, что они есть. Поэтому очень важно регулярно измерять давление и принимать меры для поддержания его на здоровом уровне, - говорит собеседница агентства.,- Вы можете пройти проверку в аптеках или у терапевта. Факторы образа жизни, такие как избыточный вес, курение, чрезмерное употребление алкоголя, отсутствие физических упражнений и нездоровая диета, могут привести к повышению артериального давления. Оно также имеет тенденцию повышаться с возрастом, поэтому повышенное кровяное давление чаще встречается у людей среднего и пожилого возраста, - добавила она.,Специалисты NHS Великобритании для предотвращения инсульта рекомендуют соблюдать сбалансированную диету, заниматься физическими упражнениями и отказаться от вредных привычек.,Необходимо избегать жирной, жареной и слишком соленой пищи. Вместо этого добавить больше овощей и продуктов с высоким содержанием клетчатки. ""Соблюдение баланса в питании очень важно. Не ешьте очень много какой-то одной пищи, особенно обработанных продуктов, и блюда с высоким содержанием соли. Вы должны сократить объем соли до не более 6 граммов в день, так как соль увеличивает кровяное давление"", - отметили в NHS.,Второе – регулярно выполняйте физические упражнения, укрепляющие сердечно-сосудистую систему. ""Большинству людей рекомендуется выполнять как минимум 150 минут аэробных упражнений средней интенсивности в неделю. Это ходьба в быстром темпе или езда на велосипеде"", - пояснили в NHS.,Курение и чрезмерное употребление алкоголя существенно повышают риск инсульта, так как из-за курения сужаются кровеносные сосуды и артерии, а алкоголь повышает давление и вызывает аритмию. ""Вы можете сократить риск инсульта, прекратив курить. Помните, что чрезмерное употребление алкоголя увеличивает риск удара более чем в три раза"", - отметили в NHS.,Еще одним фактором, повышающим риск инсульта, специалисты называют заместительную гормональную терапию (ЗГТ), которую применяют женщины старше 50 лет. ""На тысячу женщин, принимающих ЗГТ, у шести может развиться инсульт, а у восьми - тромб. Ваш врач должен обсудить с вами эти риски, чтобы вы могли решить, подходит ли вам такая терапия"", - предупредила Шаттлуорф.,Больше новостей в Telegram-канале ,. Подписывайся!",Как снизить риск инсульта
0,,"29 октября 2019, 10:48",", передает ,.,Президент Касым-Жомарт Токаев прибыл в Алматы , и начал работу с совещания в акимате.,Глава города обратился к главе государства с просьбой поручить правительству рассмотреть и утвердить Комплексный план ""Новый Алматы"" на 2020-2024 годы.,По его словам, еще одним системным решением для обеспечения разных источников финансирования является расширение полномочий города в вопросах долгосрочного заимствования.,Так же он отдельно отметил проблему нехватки земель для развития мегаполиса., ,Больше новостей в Telegram-канале ,. Подписывайся!",Сагинтаев ознакомил Президента с проблемами города 
0,,,,
0,,"29 октября 2019, 10:57"," передает ,.,Глава мегаполиса обратился к Президенту с просьбой оказать поддержку в решении вопроса по расширению Индустриальной зоны Алматы.,Больше новостей в Telegram-канале ,. Подписывайся!",Аким Алматы предложил варианты решения проблем города
1,Чем Домодедово лучше терминала Е Шереметьево??? Лично мне не удобно. Буду лететь Аэрофлотом теперь.,"29 октября 2019, 09:58"," передает корреспондент,.,28 октября в Домодедово состоялось торжественное мероприятие в связи с этим событием.,Своеобразным открытием торжественной части стала традиционная встреча нового рейса ""водяной аркой"".,Выбор Домодедово в качестве нового базового аэропорта в Москве не случаен. ""Эйр Астана"" подписала кодшеринговое соглашение с авиакомпанией S7, базирующейся в Домодедово. И это позволит пассажирам ""Эйр Астаны"" комбинировать маршруты.,В маршрутную сеть входит более 60 направлений ""Эйр Астаны"" и S7. Например, российские пассажиры могут с удобными стыковками добраться до курортов и городов Юго-Восточной Азии, или воспользоваться программой ""Стоповер"" в Нур-Султане и Алматы, посетив красивые места Казахстана. В 2018 году этой программой воспользовались более 17 тыс. человек.,По словам Питера Фостера, о том, чтобы зайти в Домодедово, начали думать еще в 2008 году, 11 лет понадобилось для осуществления планов.,По словам директора аэропорта Домодедово Игоря Борисова, исторически все государства Средней Азии осуществляли полеты в Москву через Домодедово.,К слову, об обновленной инфраструктуре аэровокзала. Стоит отметить, что для граждан Таможенного Союза есть отдельные паспортные каналы, что ускоряет процесс прохождения контроля.,Также невозможно оставить без внимания выставку ретромобилей, размещенную в новом зеркальном атриуме. В состав уникальных авто вошел Renault, который Владимир Маяковский подарил своей музе Лиле Брик.,Первым пассажирам, путешествующим в Москву с 27 октября по 31 декабря 2019 года, ""Эйр Астана"" предоставляет бесплатный проезд на аэроэкспрессе из Домодедово до Павелецкого вокзала.,В настоящее время авиакомпания выполняет 11 еженедельных рейсов Нур-Султан - Москва - Нур-Султан и 14 еженедельных рейсов Алматы - Москва - Нур-Султан на новейших самолетах A320 и A321 neo.,Больше новостей в Telegram-канале ,. Подписывайся!","""Эйр Астана"" совершила первый рейс в московский Домодедово"
0,,"29 октября 2019, 11:11"," сообщает ,В работе совещания приняли участие ответственный секретарь МОН Канат Сарсембаев, ректоры ЕНУ им. Л.Н. Гумилева и университета КАЗГЮУ, руководители подведомственных организаций МОН, а также представители проектного офиса по противодействию коррупции МОН ""ADAL BILIM"".,Как отметили в Антикоррупционной службе, главной целью оптимизации государственных органов, в том числе их подведомственных организаций является создание компактного государственного аппарата с конкурентоспособной заработной платой.,В рамках встречи проектным офисом ""ADAL BILIM"" представлены промежуточные результаты анализа отдельных подведомственных организаций МОН.,К примеру, АО ""НЦПК ""Өрлеу"" не задействован на 50% и дублирует программы курсов повышения квалификации других структур, таких как Центра педагогического мастерства при АОО ""Назарбаев интеллектуальные школы"" и его филиалов, а также частных учебных центров и организаций.,К примеру, из 20 слушателей только трое имели достаточный уровень знания английского языка для понимания материала курса, так как были преподавателями английского языка. Остальные слушатели в анкетах-отзывах отмечают в качестве существенной проблемы – незнание английского языка, при том, что курс рассчитан на слушателей с уровнем английского языка не ниже ""Intermediate"".,Анализ материально-технической базы позволил выявить факты нерационального использования зданий и помещений при фактически небольшой численности сотрудников.,Так, расходы на аренду здания НАО Холдинг ""Қәсіпқор"" составили 52 547 140 тенге при общей площади здания в 1567 кв.м, тогда как общая штатная численность составляет 70 человек.,По мнению С. Пена, в большей степени сомнения в эффективности деятельности и порядке исполнения государственных заданий вызывают такие подведомственные организаций МОН, как АО ""НЦПК ""Өрлеу"" и НАО Холдинг ""Қәсіпқор"", которые ежегодно осваивают значительные бюджетных средства.,В свою очередь, участники совещания отметили важность оптимизации, которая даст возможность высвободить неэффективно используемые средства, что соответственно, позволит обеспечить конкурентоспособной заработной платой сотрудников министерства и повысить их благосостояние, особенно сотрудников территориальных подразделений.,По итогам совещания были определены пути дальнейшей реализации проекта, направленные на выработку мер по оптимизации подведомственных организаций МОН.,Больше новостей в Telegram-канале ,. Подписывайся!","Дублирование функций, нерациональное использование площадей, премии - итоги проверки МОН"
3,"ежики совсем опупели,в 102 не дозвонится,особенно в Чимкенте и области,тебя найдут только тогда,когда ты уже трупик окоченелый и то-если найдут и кто то не забашляет,чтобы тебя не нашли,и снова Чимкент,когда же с ним покончат?","29 октября 2019, 10:04"," сообщает ,Сотрудники Казыгуртского РОП сразу же приступили к оперативно-розыскным мероприятиям. Полицейские провели комплекс необходимых мероприятий, опросили потерпевшего и других свидетелей. Получив приметы подозреваемых, оперативники принялись за розыск угнанной автомашины. ,Стражи порядка вернули похищенную автомашину законному владельцу, который выразил благодарность сотрудникам Казыгуртского РОП. В настоящее время проводится досудебное расследование по , УК РК ""вымогательство"". Подозреваемые арестованы.,Полицейские Туркестанской области рекомендуют быть бдительными и принять меры к сохранности своего имущества, жизни и здоровья. Собираясь в далекий путь, не стоит выезжать одному, а также проявлять излишнюю доверчивость к малознакомым людям. Если же вы стали жертвой или очевидцем подобных преступлений, то незамедлительно обращайтесь в полицию по телефону 102.,Больше новостей в Telegram-канале ,. Подписывайся!",В Туркестанской области пассажиры напали на таксиста и забрали у него автомобиль
0,,"29 октября 2019, 11:24"," Об этом корреспонденту , сообщил адвокат Манзорова Алмас Демесинов.,29 октября в Сети ,, в котором сообщается, что 28 октября Генеральной прокуратурой прекращено уголовное дело, возбужденное по части 4 статьи , ""Мошенничество"" в отношении Багдата Манзорова.,Преследование отменено как незаконное.,Багдата Манзорова , в конце сентября. Его подозревали , в особо крупном размере с использованием служебного положения. После задержания замакима поместили в следственный изолятор. Позже меру пресечения изменили на домашний арест. 18 октября стало известно, что Багдат Манзоров находится ,.,О том, где находится Багдат Манзоров сейчас, адвокат не сообщил.,Больше новостей в Telegram-канале ,. Подписывайся!",Генпрокуратура прекратила дело против замакима Алматинской области
0,,,,
0,,,,
0,,"29 октября 2019, 11:05"," сообщает , со ссылкой на пресс-службу акимата столицы.,В феврале нынешнего года образовался коммуникативный вакуум между госорганами и жителями. Для решения этой проблемы городская администрация приняла концептуальные меры, которые должны улучшить качество деятельности общественных приемных.,Во-первых, сегодня основная деятельность акимата направлена на укрепление обратной связи с населением и полноценное взаимодействие с гражданским обществом. К примеру, в столице активно задействована площадка ""обратной связи"" в социальных сетях, работают центры ""Жанұя"" и iKomek, внедрены принципы открытого акимата, также для более эффективного взаимодействия работает общественная приемная при акиме города.,Так, основной круг вопросов касается получения жилья, образования, списания кредитной задолженности, здравоохранения, трудоустройства и материальной помощи, благоустройства, ЖКХ, дорог.,Во-вторых, Центр поддержки института семьи ""Жанұя"", который объединяет более 70 государственных услуг, оказывает услуги горожанам по принципу ""одного окна"". Со дня открытия в центр обратились более 4,5 тыс. человек с 8,5 тыс. вопросов. Из них по 6,5 тыс. вопросам даны системные консультации, почти 2 тыс. вопросов решены.,В-третьих, районными акиматами внедрены принципы ""Open Akimat"", в рамках которого были проведены Дни открытых дверей с участием более 1000 жителей столицы.,Больше новостей в Telegram-канале ,. Подписывайся!",Советник акима Нур-Султана: Квартиры в столице выдаются только по очереди
9,"а метро от Мамышулы до Калкамана ? А алтын - орда ?,никогда! никогда! никогда ,Вопрос важный для города и такие развязки нужны. Поток машин все больше с каждым годом.,Б. Сагинтаев лучший аким на последние годы города Алматы,За последние. Таких акимов ещё не было в городе,При Байбеке город был чище. Посмотрим, что будет, когда выпадет снег.,При чем как всегда только несколько человек не хочет продавать свои участки. Все верят, что за свои дачи могут получить миллионы.,Сейчас в городе столько пробок, что быстрее пешком ходить. Это нужно менять.,А что, проблема выкупить участки? Или люди не хотят переезжать из насиженных мест? Но это же нужное дело для города.","29 октября 2019, 11:03",", сообщает ,.,Он также рассказал о том, к каким плюсам приведет введение этих развязок.,Больше новостей в Telegram-канале ,. Подписывайся!",Сагинтаев поднял вопрос выкупа земель в Алматы под развязки
